{
  "schema_version": "1.0",
  "release_id": "release_20250108_01",
  "plan_id": "plan_a3f5b2c8",
  "created_at": "2025-01-08T13:30:00Z",
  "release_manager_agent_id": "agent_release_engineer",
  "artifacts": [
    {
      "name": "backend_image.tar",
      "sha256": "sha256:REPLACE_ME"
    },
    {
      "name": "frontend_build.zip",
      "sha256": "sha256:REPLACE_ME"
    }
  ],
  "evidence_required": [
    "build_validation_result.json",
    "deploy_validation_result.json",
    "smoke_test_result.json",
    "e2e_test_result.json",
    "security_scan_result.json"
  ],
  "evidence_refs": [
    {
      "name": "build_validation_result.json",
      "sha256": "sha256:REPLACE_ME"
    }
  ],
  "decision": "APPROVE",
  "notes": "APPROVE means all required evidence exists and passed for this release_id."
}

